{
  "ad_id": "ad_005",
  "hook": {
    "type": "relatable_moment",
    "face_first_frame": true,
    "text_overlay_first_frame": false,
    "brand_visible_3s": false,
    "audio_hook": "dialogue",
    "language": "Hindi",
    "effectiveness_note": "Opens with a service professional (relatable if you have ever had an RO serviced) speaking in authentic working-class dialogue. The humor comes from the unexpected eloquence/absurdity of a mundane service interaction. Stops the scroll because it looks like real life, not an ad."
  },
  "narrative": {
    "arc_type": "demo",
    "tension_payoff": "buildup",
    "num_scenes": 5,
    "effectiveness_note": "Product demo disguised as comedy sketch. The USP (Native RO features) is delivered through funny dialogue, not a feature list. Viewers absorb product information without feeling sold to. The 1980s Bollywood aesthetic makes it memorable — it is not just a demo, it is a demo in a distinctive world."
  },
  "pacing": {
    "duration_bucket": "30s",
    "cuts_per_15s": 4,
    "pace_changes": [
      "0-5s: establishes scenario",
      "5-20s: comedic build with product info",
      "20-30s: retro musical payoff"
    ],
    "pattern_interrupts": [
      "15s: retro Bollywood music drop is a sharp tonal shift that re-grabs attention"
    ],
    "retention_note": "The retro aesthetic is itself a pattern interrupt — viewers think 'wait, is this an 80s movie?' The tonal contrast between mundane service scenario and Bollywood musical treatment keeps the brain engaged through incongruity."
  },
  "audio": {
    "music_type": "original_score",
    "voiceover": true,
    "voiceover_tone": "conversational",
    "language": "Hindi",
    "music_visual_sync": true,
    "audio_note": "Retro Bollywood score is the signature audio element. It transforms a product demo into entertainment. The music style signals nostalgia and warmth while making the product features feel important and dramatic. Brilliant tonal mismatch that works."
  },
  "visual": {
    "talent_type": "actor",
    "production_quality": "mid",
    "text_overlay_density": "minimal",
    "color_mood": "bright",
    "product_visibility": "always_visible",
    "visual_note": "Retro color grading gives a warm, amber tone reminiscent of 80s Bollywood. This visual distinctiveness means you immediately know it is an Urban Company ad even before the logo appears. The product (RO purifier) is visible throughout but never feels like a product shot because the comedic scene gives it context."
  },
  "cta": {
    "type": "download_app",
    "timing": "late",
    "visual_treatment": "combined",
    "urgency_element": "none",
    "cta_note": "CTA to download Urban Company app at the end. Feels natural because the ad demonstrated a service you would book through the app. The entire ad is an answer to 'why should I use Urban Company for RO service?' — CTA is just the how."
  },
  "brand": {
    "logo_presence": "end_card_only",
    "brand_first_named_seconds": 25,
    "brand_voice_consistent": true,
    "brand_note": "Brand reveal late but the retro aesthetic IS the brand identity for this campaign. Distinctive enough that repeat viewers recognize it instantly. Urban Company is building a visual language that transcends the logo."
  },
  "emotional": {
    "primary_emotion": "humor",
    "cultural_specificity": [
      "urban/rural"
    ],
    "hinglish_level": "pure_hindi",
    "cultural_note": "The service professional as comedic talent is culturally specific to India where home services (plumber, electrician, RO technician) are frequent household interactions. Every Indian household recognizes this scenario. The humor is affectionate, not mocking — important distinction."
  },
  "x_factor": "The retro Bollywood aesthetic turns a forgettable product demo into appointment viewing. It is a distinctive visual and tonal world that no competitor can replicate without looking like a copycat. This is brand moat through creative execution. The product information lands BECAUSE it is wrapped in entertainment, not despite it. The viewer remembers both the joke AND the feature — that is the rarest outcome in advertising.",
  "lessons_for_wiom": [
    "Distinctive aesthetic as brand moat: Wiom could develop a visual world (retro? animated? documentary?) that makes every ad instantly recognizable even before the logo appears. Consistency across campaigns builds cumulative recognition.",
    "Demo disguised as entertainment: instead of listing broadband speeds, show a technician installing Wiom fiber while having a funny conversation that naturally reveals product benefits. The human interaction carries the information.",
    "Home service scenarios are perfect for home internet brands. The installer, the family, the living room — these are Wiom's natural territories. Own them creatively."
  ]
}