{
  "ad_id": "ad_001",
  "hook": {
    "type": "visual_surprise",
    "face_first_frame": true,
    "text_overlay_first_frame": false,
    "brand_visible_3s": true,
    "audio_hook": "music_hit",
    "language": "Hindi",
    "effectiveness_note": "Characters from popular shows literally bursting onto screen creates instant recognition and curiosity. Viewers think 'that's my show' which stops the scroll. Leverages parasocial attachment to fictional characters."
  },
  "narrative": {
    "arc_type": "montage",
    "tension_payoff": "front_loaded",
    "num_scenes": 8,
    "effectiveness_note": "Montage of entertainment characters creates a 'greatest hits' feeling. No single narrative to follow means low cognitive load. Each scene is self-contained — if you miss one, the next still works. Keeps viewers watching to see which show appears next."
  },
  "pacing": {
    "duration_bucket": "30s",
    "cuts_per_15s": 6,
    "pace_changes": [
      "0-3s: high energy opener",
      "15s: brief product shot slows pace",
      "25s: energy ramps for finale"
    ],
    "pattern_interrupts": [
      "Each new character entrance acts as a mini pattern interrupt"
    ],
    "retention_note": "Risk of drop-off at mid-point when product messaging kicks in. The character parade format prevents this by promising 'what show is next?' curiosity throughout."
  },
  "audio": {
    "music_type": "original_score",
    "voiceover": true,
    "voiceover_tone": "energetic",
    "language": "Hindi",
    "music_visual_sync": true,
    "audio_note": "Catchy original soundtrack synced to character entrances. Music carries the energy between scenes. Multi-lingual versions (9 languages) mean the audio layer was designed as the primary retention tool — it works regardless of language comprehension."
  },
  "visual": {
    "talent_type": "actor",
    "production_quality": "high",
    "text_overlay_density": "minimal",
    "color_mood": "bright",
    "product_visibility": "reveal_moment",
    "visual_note": "High production value matches the entertainment promise. Bright, saturated colors signal 'premium entertainment experience.' Product (fiber connection) is abstract so they visualize it through the content it enables — smart choice for an infrastructure product."
  },
  "cta": {
    "type": "visit_site",
    "timing": "late",
    "visual_treatment": "combined",
    "urgency_element": "none",
    "cta_note": "CTA is 'get Xstream Fiber' at the end. Feels like a natural conclusion — after showing all this entertainment, the ask is simply 'want access to all of this?' The entertainment montage itself is the argument. CTA does not feel forced but lacks urgency."
  },
  "brand": {
    "logo_presence": "bookend",
    "brand_first_named_seconds": 3,
    "brand_voice_consistent": true,
    "brand_note": "Airtel brand appears early and at end. The entertainment focus IS the brand voice for Xstream Fiber specifically. Brand enhances rather than interrupts because the characters validate the entertainment promise."
  },
  "emotional": {
    "primary_emotion": "aspiration",
    "cultural_specificity": [
      "family",
      "urban/rural"
    ],
    "hinglish_level": "pure_hindi",
    "cultural_note": "Entertainment as aspiration is deeply rooted in Indian culture — the living room TV is the center of family life. Multi-lingual versions signal 'this is for everyone, not just metros.' Regional language versions with local show characters would resonate strongly in Tier 2-3."
  },
  "x_factor": "The 9-language localization is not just translation — it implies different entertainment content per region, which makes the ad itself feel personalized. Most ISP ads show speed tests or buffering wheels. This one never mentions speed once. It sells the dream (entertainment) not the pipe (broadband). That reframe is the creative breakthrough.",
  "lessons_for_wiom": [
    "Sell the dream, not the pipe: Wiom could show what reliable internet ENABLES (kids acing online classes, family movie nights, parents video-calling grandparents) rather than speeds and plans.",
    "Regional language versions with locally relevant content are not optional for Tier 2-3 India — Airtel did 9 languages, Wiom should plan for at least 3-4 from day one.",
    "Entertainment montage format works for broadband because the product is invisible — you can only show what it delivers, not the product itself."
  ]
}