{
  "ad_id": "ad_006",
  "hook": {
    "type": "relatable_moment",
    "face_first_frame": true,
    "text_overlay_first_frame": false,
    "brand_visible_3s": false,
    "audio_hook": "voiceover",
    "language": "Hindi",
    "effectiveness_note": "Opens with a daily-life scenario everyone recognizes (like saving a seat, or buying extra when something is cheap). The mundane familiarity disarms the viewer — it does not feel like a finance ad. The hook works by making you nod before you realize you are being taught."
  },
  "narrative": {
    "arc_type": "comparison",
    "tension_payoff": "buildup",
    "num_scenes": 5,
    "effectiveness_note": "Parallel structure: everyday scenario THEN investment concept. This A-to-B mapping is the core mechanic. Each pair of scenes builds the argument that investing is not exotic — you already do it instinctively. The build-up across multiple analogies creates cumulative persuasion."
  },
  "pacing": {
    "duration_bucket": "30s",
    "cuts_per_15s": 4,
    "pace_changes": [
      "0-10s: first analogy, slow setup",
      "10-30s: rapid analogy series",
      "30-40s: brand payoff"
    ],
    "pattern_interrupts": [
      "Each new analogy is a mini-reset that re-engages attention"
    ],
    "retention_note": "The analogy format creates a game-like experience: viewer tries to guess the investment concept before it is revealed. This predictive engagement is a strong retention mechanism. Low drop-off risk because each analogy is self-contained and interesting on its own."
  },
  "audio": {
    "music_type": "original_score",
    "voiceover": true,
    "voiceover_tone": "conversational",
    "language": "Hindi",
    "music_visual_sync": false,
    "audio_note": "Warm, conversational voiceover in Hindi. Not authoritative or preachy — feels like a wise friend explaining something. The tone deliberately avoids the typical finance ad gravitas. Light background score stays out of the way. The voice does all the work."
  },
  "visual": {
    "talent_type": "actor",
    "production_quality": "mid",
    "text_overlay_density": "minimal",
    "color_mood": "bright",
    "product_visibility": "absent_until_cta",
    "visual_note": "Everyday Indian settings: vegetable market, kitchen, neighborhood. Deliberately ordinary to reinforce the message that investing is ordinary. No suits, no offices, no graphs. The visual strategy is to DE-financialize finance. This is revolutionary for the category."
  },
  "cta": {
    "type": "learn_more",
    "timing": "late",
    "visual_treatment": "combined",
    "urgency_element": "none",
    "cta_note": "Soft CTA. The ad's goal is perception shift (investing is not scary) not immediate conversion. Appropriate for the category — mutual fund purchases are considered decisions. The lack of urgency is intentional and correct."
  },
  "brand": {
    "logo_presence": "end_card_only",
    "brand_first_named_seconds": 35,
    "brand_voice_consistent": true,
    "brand_note": "HDFC MF brand appears only at the end. The ad builds trust through the relatable content first, then attaches the brand. For a financial brand, this trust-first approach is more effective than leading with the brand name."
  },
  "emotional": {
    "primary_emotion": "relatability",
    "cultural_specificity": [
      "urban/rural"
    ],
    "hinglish_level": "pure_hindi",
    "cultural_note": "Uses specifically Indian middle-class daily-life scenarios. The analogies are drawn from sabzi mandi, chai stalls, and household habits — unmistakably Indian. This grounds abstract financial concepts in the physical reality of Indian middle-class life. The cultural specificity IS the strategy."
  },
  "x_factor": "The reframe is everything. Every mutual fund ad in India either uses jargon-heavy explanations or celebrity endorsements. This ad does neither. It says 'you are already an investor — you just do not know it.' That single insight transforms the entire communication. It does not teach DOWN to the audience; it reveals intelligence the audience already has. This is respectful, empowering advertising, and it is devastatingly effective for a category plagued by intimidation.",
  "lessons_for_wiom": [
    "Reframe the commodity: instead of selling broadband, show that families are already using internet for everything that matters (kids learning, parents working, family connecting) — they just need RELIABLE internet. The need already exists; Wiom just fulfills it.",
    "Analogy-based storytelling makes complex or boring products accessible. Wiom could compare broadband reliability to something every family understands: 'you would not accept electricity that cuts out 5 times a day, so why accept internet that does?'",
    "Respect the audience's intelligence. Do not explain what broadband is. Assume they know. Show them why Wiom's version is different — through scenarios, not specs."
  ]
}