{
  "ad_id": "ad_013",
  "hook": {
    "type": "controversy",
    "face_first_frame": true,
    "text_overlay_first_frame": false,
    "brand_visible_3s": false,
    "audio_hook": "dialogue",
    "language": "Hindi",
    "effectiveness_note": "Opens with a parent and child in a mild argument about patriotism — a politically charged topic that immediately creates tension. Controversy hooks work because they trigger emotional engagement before rational evaluation. The family setting makes it feel intimate rather than preachy."
  },
  "narrative": {
    "arc_type": "single_scene",
    "tension_payoff": "buildup",
    "num_scenes": 3,
    "effectiveness_note": "Single living-room conversation that builds from disagreement to understanding. The generational tension is the engine: parents believe patriotism means one thing, kids believe it means another. Neither is wrong. The narrative does not resolve the debate — it reframes it. Viewers stay because they are choosing sides."
  },
  "pacing": {
    "duration_bucket": "60s+",
    "cuts_per_15s": 2,
    "pace_changes": [
      "0-15s: scene setting and positions established",
      "15-40s: debate escalates with emotional stakes",
      "40-55s: emotional resolution/reframe",
      "55-60s: brand moment"
    ],
    "pattern_interrupts": [
      "25s: one character says something unexpectedly vulnerable that shifts the debate from intellectual to emotional"
    ],
    "retention_note": "Debate format is inherently high-retention because the viewer is actively processing arguments and forming opinions. You cannot passively watch a debate — your brain engages. The family context adds emotional stakes to the intellectual content."
  },
  "audio": {
    "music_type": "no_music",
    "voiceover": false,
    "voiceover_tone": null,
    "language": "Hindi",
    "music_visual_sync": false,
    "audio_note": "No music during the conversation — just dialogue in a living room. This is a bold choice that creates intimacy and realism. The absence of music makes every word land harder. A score would signal 'this is an ad' — the silence says 'this is real.' Music only enters at the brand moment."
  },
  "visual": {
    "talent_type": "actor",
    "production_quality": "high",
    "text_overlay_density": "none",
    "color_mood": "muted",
    "product_visibility": "absent_until_cta",
    "visual_note": "Middle-class living room set. Muted, natural lighting — no advertising gloss. The visual restraint matches the conversational tone. Close-ups on faces during dialogue mirror the emotional intimacy. The living room IS the visual strategy: this is where India's conversations happen."
  },
  "cta": {
    "type": "other",
    "timing": "late",
    "visual_treatment": "voiceover_only",
    "urgency_element": "none",
    "cta_note": "No commercial CTA. 'Jaago Re' (wake up) is the call to action — a call to think, not to buy. The tea appears in the scene naturally (family having chai during discussion). The product is incidental to the conversation it enables. Brand building through cultural relevance."
  },
  "brand": {
    "logo_presence": "end_card_only",
    "brand_first_named_seconds": 55,
    "brand_voice_consistent": true,
    "brand_note": "Tata Tea's 'Jaago Re' platform has run for over 15 years, establishing the brand as a catalyst for social conversations. The brand delayed until the end works because the debate format IS the Jaago Re brand. The chai in the scene is a subtle visual brand presence throughout."
  },
  "emotional": {
    "primary_emotion": "pride",
    "cultural_specificity": [
      "family"
    ],
    "hinglish_level": "pure_hindi",
    "cultural_note": "Generational debates about India are a living-room staple. Every Indian family has had a version of this conversation. The ad captures a REAL dynamic rather than inventing one. The patriotism topic during Republic Day or Independence Day timing is culturally precise. The debate format respects the audience by not giving easy answers."
  },
  "x_factor": "This ad turns a brand into a conversation starter. Most ads try to end conversations (buy this, done). Tata Tea starts them. The 'Jaago Re' platform is brilliant because it positions tea as the fuel for meaningful family discussions. The ad works because it does not preach — both sides of the generational debate are presented with empathy. The viewer leaves thinking about patriotism and family, not about tea. But the association (Tata Tea equals thoughtful conversations) is permanently planted.",
  "lessons_for_wiom": [
    "Internet as conversation enabler: Wiom could position itself as what POWERS the family conversations that matter. Not just 'fast internet' but 'the connection behind every connection.' A family debating something important over a video call with grandparents — powered by Wiom.",
    "Living room as brand territory: for a home internet provider, the living room is the natural stage. Showing real family dynamics (generational debates, kids teaching parents tech, family movie night disagreements) in the living room where the Wiom router sits quietly in the background.",
    "Debate format drives shareability: people shared this ad because they wanted to continue the debate. Wiom could create debate-format content ('Is unlimited data a right or a privilege?') that people share to express their position."
  ]
}