{
  "ad_id": "ad_008",
  "hook": {
    "type": "visual_surprise",
    "face_first_frame": true,
    "text_overlay_first_frame": false,
    "brand_visible_3s": true,
    "audio_hook": "dialogue",
    "language": "Hindi",
    "effectiveness_note": "Opens with Colgate apparently selling food — a toothpaste brand selling biryani or chaat. The incongruity is immediate and irresistible. Viewers MUST watch to resolve the confusion: 'why is Colgate selling food?' The cognitive dissonance is the hook."
  },
  "narrative": {
    "arc_type": "problem_solution",
    "tension_payoff": "front_loaded",
    "num_scenes": 4,
    "effectiveness_note": "The inversion structure carries the narrative: brand does opposite of what you expect, which makes the actual message (brush at night) land harder. The structure is: surprise (Colgate sells food) -> explanation (because you need to brush after eating) -> product. The logic chain is clear and satisfying."
  },
  "pacing": {
    "duration_bucket": "30s",
    "cuts_per_15s": 5,
    "pace_changes": [
      "0-5s: surprise hook",
      "5-15s: escalating food scenarios",
      "15-25s: reveal and message",
      "25-30s: product and CTA"
    ],
    "pattern_interrupts": [
      "5s: first food item reveal",
      "15s: message pivot from food to brushing"
    ],
    "retention_note": "The surprise hook creates a question that must be answered. Viewers stay to understand WHY Colgate is selling food. Once the reveal happens at 15s, the payoff is satisfying enough that viewers watch through the product message. Low drop-off because the curiosity gap is tight."
  },
  "audio": {
    "music_type": "original_score",
    "voiceover": true,
    "voiceover_tone": "conversational",
    "language": "Hindi",
    "music_visual_sync": false,
    "audio_note": "Playful tone in voiceover matches the inversions visual surprise. The voiceover sells food with genuine enthusiasm which makes the eventual pivot funnier. Light, bouncy music supports the playful tone without dominating."
  },
  "visual": {
    "talent_type": "actor",
    "production_quality": "high",
    "text_overlay_density": "minimal",
    "color_mood": "bright",
    "product_visibility": "reveal_moment",
    "visual_note": "Food is shot beautifully (food-ad quality) which deepens the inversion joke — this LOOKS like a food ad. The visual craft serves the misdirection. When the Colgate tube appears, the contrast with the food imagery is stark and memorable."
  },
  "cta": {
    "type": "other",
    "timing": "late",
    "visual_treatment": "combined",
    "urgency_element": "none",
    "cta_note": "CTA is behavioral (brush at night) not commercial (buy Colgate). This is a long-term category-building strategy. If people brush at night, they buy more toothpaste. The CTA serves Colgate's business without being transactional."
  },
  "brand": {
    "logo_presence": "bookend",
    "brand_first_named_seconds": 2,
    "brand_voice_consistent": true,
    "brand_note": "Colgate visible from the start — critical for the inversion to work. You NEED to know it is Colgate selling food for the surprise to land. Brand presence enhances the creative rather than interrupting it. One of the rare cases where early brand reveal makes the ad better."
  },
  "emotional": {
    "primary_emotion": "humor",
    "cultural_specificity": [
      "family",
      "urban/rural"
    ],
    "hinglish_level": "pure_hindi",
    "cultural_note": "Night eating (late dinner, midnight snacking) is universal in Indian households. The food items shown (biryani, chaat) are culturally specific and appetizing. The ad taps into the guilty pleasure of eating late, which is relatable across class and region."
  },
  "x_factor": "The inversion mechanic is what makes this exceptional. A toothpaste brand selling food is such a clean, simple concept that it feels obvious in hindsight — the hallmark of a great idea. It makes the 'brush at night' message unforgettable because it is wrapped in a memorable joke. The brand benefits from early reveal (unusual) because the brand-doing-unexpected-thing IS the joke.",
  "lessons_for_wiom": [
    "Inversion as creative technique: what is the OPPOSITE of what an ISP would advertise? An ISP promoting 'disconnect time' or 'go outside' could be a powerful inversion that ultimately reinforces why you need reliable internet (so you can disconnect on YOUR terms, not because it dropped).",
    "Early brand reveal works when the brand is part of the surprise. If Wiom did something unexpected (ISP selling board games, ISP promoting outdoor activities), the brand visibility is essential to the joke.",
    "Behavior change messaging (brush at night / check your internet speed) can build category while building brand. Wiom could promote 'test your internet speed' as a behavior that ultimately drives switching."
  ]
}